{
  "schema_version": "run_world_state.v0.1",
  "run_id": "run_demo_001",
  "worldbook_id": "long_night_lanterns",
  "progress": {
    "chapter": 1,
    "turn": 1,
    "phase": "northern_road_scouting"
  },
  "global_state": {
    "pressure": 0.3,
    "hope": 0.67,
    "visibility": 0.28
  },
  "resources": [
    {
      "resource_id": "lamp_oil",
      "amount": 11
    },
    {
      "resource_id": "iron_scrap",
      "amount": 5
    },
    {
      "resource_id": "rationed_food",
      "amount": 8
    },
    {
      "resource_id": "lantern_ash",
      "amount": 2
    },
    {
      "resource_id": "lamp_shard",
      "amount": 2
    },
    {
      "resource_id": "conductor_filament",
      "amount": 1
    }
  ],
  "map_nodes": [
    {
      "node_id": "gray_lantern_station",
      "status": "secured",
      "threat_level": 0,
      "visibility": "visible",
      "available_actions": [
        "field_research",
        "rest"
      ]
    },
    {
      "node_id": "northern_road_crossing",
      "status": "known",
      "threat_level": 1,
      "visibility": "scouted",
      "available_actions": [
        "scout",
        "field_research",
        "prepare_route"
      ]
    },
    {
      "node_id": "old_signal_tower",
      "status": "known",
      "threat_level": 2,
      "visibility": "scouted",
      "available_actions": [
        "scout",
        "mark_threat"
      ]
    },
    {
      "node_id": "supply_line_hub_to_gray",
      "status": "contested",
      "threat_level": 1,
      "visibility": "known",
      "available_actions": [
        "repair_route",
        "field_research",
        "assign_support"
      ]
    },
    {
      "node_id": "lamp_wick_store",
      "status": "known",
      "threat_level": 1,
      "visibility": "known",
      "available_actions": [
        "inspect_storage",
        "prepare_defense"
      ]
    }
  ],
  "npcs": [
    {
      "npc_id": "engineer_001",
      "location_node_id": "gray_lantern_station",
      "narrative_roles": [
        "battle_feedback"
      ],
      "gameplay_roles": [
        "field_engineer"
      ],
      "relationship": {
        "trust": 0.45
      },
      "availability": "present"
    },
    {
      "npc_id": "scout_002",
      "location_node_id": "northern_road_crossing",
      "narrative_roles": [
        "world_observation"
      ],
      "gameplay_roles": [
        "scout"
      ],
      "relationship": {
        "trust": 0.3
      },
      "availability": "present"
    },
    {
      "npc_id": "npc_wire_mender_003",
      "location_node_id": "supply_line_hub_to_gray",
      "narrative_roles": [
        "route_pressure_hint",
        "workshop_witness"
      ],
      "gameplay_roles": [
        "route_repair",
        "material_adjustment",
        "field_review"
      ],
      "relationship": {
        "trust": 0.25
      },
      "availability": "present"
    },
    {
      "npc_id": "npc_road_scout",
      "location_node_id": "northern_road_crossing",
      "narrative_roles": [
        "dark_edge_witness",
        "route_warning"
      ],
      "gameplay_roles": [
        "path_prediction",
        "weakness_hint",
        "scouting_reliability"
      ],
      "relationship": {
        "trust": 0.2
      },
      "availability": "present"
    }
  ],
  "unlocked_facts": [
    {
      "fact_id": "refraction_trap_observed",
      "source": "first_battle",
      "visibility": "player_known",
      "summary": "灰灯驿站的折射陷阱在夜雾中第一次显形。"
    },
    {
      "fact_id": "sample_trap_tested_in_battle",
      "source": "first_battle",
      "visibility": "player_known",
      "summary": "折光绊索在灰灯驿站实战中成功拖慢了来犯影潮。"
    },
    {
      "fact_id": "refraction_snare_consumes_too_fast",
      "source": "dawn_review_supply_line",
      "visibility": "player_known",
      "summary": "折光绊索能拖慢影潮前锋，但灯灰消耗过快，后续需要护线和诱饵类方案分担压力。"
    },
    {
      "fact_id": "wire_mender_candidate_seen",
      "source": "dawn_review_supply_line",
      "visibility": "hinted",
      "summary": "补线人出现在受损补给线上，可以评估护线装置和材料替换。"
    },
    {
      "fact_id": "east_dark_echo_survey_ready",
      "source": "northern_road_scouting",
      "visibility": "player_known",
      "summary": "东暗回声测记可以短暂揭示路径压力和敌群弱点，但不能直接清除黑暗。"
    },
    {
      "fact_id": "old_signal_tower_pressure_hint",
      "source": "northern_road_scouting",
      "visibility": "hinted",
      "summary": "旧信号塔附近有回光扰动，后续可能成为压力源或可选战斗节点。"
    }
  ],
  "event_log": [
    {
      "event_id": "intro_arrival",
      "turn": 1,
      "kind": "story",
      "summary": "玩家抵达灰灯驿站，长夜尚未散去。"
    },
    {
      "event_id": "gray_lantern_first_defense_success",
      "turn": 2,
      "kind": "battle",
      "summary": "灰灯驿站首战告捷，折光绊索拖慢了夜雾来影，驿站灯火仍亮。"
    },
    {
      "event_id": "dawn_review_supply_line_opened",
      "turn": 3,
      "kind": "resource",
      "summary": "清晨复盘完成，补给线与灯芯仓被纳入下一轮防守计划。"
    },
    {
      "event_id": "northern_road_scouting_completed",
      "turn": 4,
      "kind": "world",
      "summary": "北路黑暗边缘被短暂照亮，旧信号塔的风险被标记。"
    }
  ],
  "research": {
    "active_jobs": [
      {
        "job_id": "research_signal_wick_decoy_trial",
        "status": "completed",
        "started_turn": 3,
        "source_task_id": "task_repair_supply_line_hub",
        "source_sample_id": "sample_trap_7f3a_repaired",
        "expected_turns": 1,
        "expected_output": "信标灯芯诱饵试作"
      },
      {
        "job_id": "research_dark_echo_survey",
        "status": "completed",
        "started_turn": 4,
        "source_task_id": "task_scout_northern_road",
        "expected_turns": 1,
        "expected_output": "东暗回声测记"
      }
    ],
    "known_blueprints": [],
    "temporary_samples": [
      {
        "sample_id": "sample_trap_7f3a_repaired",
        "display_name": "折光绊索",
        "source_delta_id": "delta_stage_01_gray_lantern_first_defense",
        "summary": "从驿站战斗中回收的折光绊索样品，仍留有夜雾擦过的痕迹。"
      },
      {
        "sample_id": "intel_dark_echo_survey_001",
        "display_name": "东暗回声测记",
        "source_delta_id": "delta_stage_03_northern_road_scouting",
        "summary": "用灯灰和导线记录的短期侦测札记，可辅助下一场防守布置。"
      }
    ]
  },
  "flags": {
    "tutorial_first_battle_started": false,
    "tutorial_first_battle_completed": true,
    "stage_02_supply_line_review_completed": true,
    "stage_03_northern_scouting_completed": true
  },
  "tasks": [
    {
      "task_id": "task_repair_supply_line_hub",
      "kind": "resource",
      "status": "active",
      "title": "抢修受损补给线",
      "summary": "补给线在清晨复盘中被确认受损，需要护线装置和临时材料调配来维持下一场防守。",
      "node_id": "supply_line_hub_to_gray",
      "npc_id": "npc_wire_mender_003",
      "objective_refs": [
        "supply_line_hub_to_gray",
        "asset_wick_barrier_pylon"
      ],
      "reward_refs": [
        "lantern_ash",
        "asset_signal_wick_decoy"
      ]
    },
    {
      "task_id": "task_prepare_wick_store_defense",
      "kind": "defense",
      "status": "available",
      "title": "准备灯芯仓防守",
      "summary": "灯芯仓是灰灯驿站的资源节点，下一轮影潮可能转向这里，需要提前布置诱饵与护幕。",
      "node_id": "lamp_wick_store",
      "npc_id": "npc_wire_mender_003",
      "objective_refs": [
        "lamp_wick_store",
        "asset_signal_wick_decoy",
        "asset_wick_barrier_pylon"
      ],
      "reward_refs": [
        "glow_crystal"
      ]
    },
    {
      "task_id": "task_scout_northern_road",
      "kind": "scouting",
      "status": "completed",
      "title": "确认北路黑暗边缘",
      "summary": "北路斥候愿意带回一段短程测记，用来判断下一场敌潮是否会绕向旧信号塔。",
      "node_id": "northern_road_crossing",
      "npc_id": "npc_road_scout",
      "objective_refs": [
        "northern_road_crossing",
        "old_signal_tower"
      ],
      "reward_refs": [
        "intel_dark_echo_survey_001"
      ]
    }
  ],
  "random_events": [
    {
      "random_event_id": "random_event_wick_store_pressure_hint",
      "event_type": "threat_warning",
      "status": "available",
      "summary": "灯芯仓外侧的影潮开始试探旧管线，若继续放任，下一场压力会转向资源库存。",
      "node_id": "lamp_wick_store",
      "trigger_turn": 4,
      "related_task_id": "task_prepare_wick_store_defense"
    },
    {
      "random_event_id": "random_event_old_signal_tower_pressure",
      "event_type": "map_pressure",
      "status": "pending",
      "summary": "旧信号塔附近的回光扰动增强，若继续侦察，可能打开新的压力节点或捷径。",
      "node_id": "old_signal_tower",
      "trigger_turn": 5,
      "related_task_id": "task_scout_northern_road"
    }
  ]
}
