{
  "schema_version": "run_world_state.v0.1",
  "run_id": "run_demo_001",
  "worldbook_id": "long_night_lanterns",
  "progress": {
    "chapter": 1,
    "turn": 1,
    "phase": "post_wick_store_defense"
  },
  "global_state": {
    "pressure": 0.3,
    "hope": 0.67,
    "visibility": 0.28
  },
  "resources": [
    {
      "resource_id": "lamp_oil",
      "amount": 11
    },
    {
      "resource_id": "iron_scrap",
      "amount": 5
    },
    {
      "resource_id": "rationed_food",
      "amount": 8
    },
    {
      "resource_id": "lantern_ash",
      "amount": 0
    },
    {
      "resource_id": "lamp_shard",
      "amount": 2
    },
    {
      "resource_id": "conductor_filament",
      "amount": 1
    },
    {
      "resource_id": "glow_crystal",
      "amount": 1
    }
  ],
  "map_nodes": [
    {
      "node_id": "gray_lantern_station",
      "status": "secured",
      "threat_level": 0,
      "visibility": "visible",
      "available_actions": [
        "field_research",
        "rest"
      ]
    },
    {
      "node_id": "northern_road_crossing",
      "status": "known",
      "threat_level": 1,
      "visibility": "scouted",
      "available_actions": [
        "scout",
        "field_research",
        "prepare_route"
      ]
    },
    {
      "node_id": "old_signal_tower",
      "status": "known",
      "threat_level": 2,
      "visibility": "scouted",
      "available_actions": [
        "scout",
        "mark_threat"
      ]
    },
    {
      "node_id": "supply_line_hub_to_gray",
      "status": "secured",
      "threat_level": 0,
      "visibility": "visible",
      "available_actions": [
        "repair_route",
        "talk_to_wire_mender"
      ]
    },
    {
      "node_id": "lamp_wick_store",
      "status": "secured",
      "threat_level": 0,
      "visibility": "visible",
      "available_actions": [
        "collect_reward",
        "field_research",
        "prepare_next_route"
      ]
    }
  ],
  "npcs": [
    {
      "npc_id": "engineer_001",
      "location_node_id": "gray_lantern_station",
      "narrative_roles": [
        "battle_feedback"
      ],
      "gameplay_roles": [
        "field_engineer"
      ],
      "relationship": {
        "trust": 0.45
      },
      "availability": "present"
    },
    {
      "npc_id": "scout_002",
      "location_node_id": "northern_road_crossing",
      "narrative_roles": [
        "world_observation"
      ],
      "gameplay_roles": [
        "scout"
      ],
      "relationship": {
        "trust": 0.3
      },
      "availability": "present"
    },
    {
      "npc_id": "npc_wire_mender_003",
      "location_node_id": "supply_line_hub_to_gray",
      "narrative_roles": [
        "route_pressure_hint",
        "workshop_witness"
      ],
      "gameplay_roles": [
        "route_repair",
        "material_adjustment",
        "field_review"
      ],
      "relationship": {
        "trust": 0.35
      },
      "availability": "present"
    },
    {
      "npc_id": "npc_road_scout",
      "location_node_id": "northern_road_crossing",
      "narrative_roles": [
        "dark_edge_witness",
        "route_warning"
      ],
      "gameplay_roles": [
        "path_prediction",
        "weakness_hint",
        "scouting_reliability"
      ],
      "relationship": {
        "trust": 0.2
      },
      "availability": "present"
    }
  ],
  "unlocked_facts": [
    {
      "fact_id": "refraction_trap_observed",
      "source": "first_battle",
      "visibility": "player_known",
      "summary": "灰灯驿站的折射陷阱在夜雾中第一次显形。"
    },
    {
      "fact_id": "sample_trap_tested_in_battle_repaired",
      "source": "first_battle",
      "visibility": "player_known",
      "summary": "折光绊索在灰灯驿站实战中成功拖慢了来犯影潮。"
    },
    {
      "fact_id": "refraction_snare_consumes_too_fast",
      "source": "dawn_review_supply_line",
      "visibility": "player_known",
      "summary": "折光绊索能拖慢影潮前锋，但灯灰消耗过快，后续需要护线和诱饵类方案分担压力。"
    },
    {
      "fact_id": "wire_mender_candidate_seen",
      "source": "dawn_review_supply_line",
      "visibility": "hinted",
      "summary": "补线人出现在受损补给线上，可以评估护线装置和材料替换。"
    },
    {
      "fact_id": "east_dark_echo_survey_ready",
      "source": "northern_road_scouting",
      "visibility": "player_known",
      "summary": "东暗回声测记可以短暂揭示路径压力和敌群弱点，但不能直接清除黑暗。"
    },
    {
      "fact_id": "old_signal_tower_pressure_hint",
      "source": "northern_road_scouting",
      "visibility": "hinted",
      "summary": "旧信号塔附近有回光扰动，后续可能成为压力源或可选战斗节点。"
    },
    {
      "fact_id": "wick_store_defense_combo_validated",
      "source": "wick_store_pressure_battle",
      "visibility": "player_known",
      "summary": "诱饵拖延、护幕稳线、灯灰爆鸣塔处理聚集敌人的组合在灯芯仓防守中通过实战检验。"
    },
    {
      "fact_id": "glow_crystal_discovered",
      "source": "wick_store_pressure_battle",
      "visibility": "player_known",
      "summary": "守住灯芯仓后，灰烬下出现少量辉晶，可作为后续正式研发的稀有材料。"
    }
  ],
  "event_log": [
    {
      "event_id": "intro_arrival",
      "turn": 1,
      "kind": "story",
      "summary": "玩家抵达灰灯驿站，长夜尚未散去。"
    },
    {
      "event_id": "gray_lantern_first_defense_repaired_success",
      "turn": 2,
      "kind": "battle",
      "summary": "灰灯驿站首战告捷，折光绊索拖慢了夜雾来影，驿站灯火仍亮。"
    },
    {
      "event_id": "dawn_review_supply_line_opened",
      "turn": 3,
      "kind": "resource",
      "summary": "清晨复盘完成，补给线与灯芯仓被纳入下一轮防守计划。"
    },
    {
      "event_id": "northern_road_scouting_completed",
      "turn": 4,
      "kind": "world",
      "summary": "北路黑暗边缘被短暂照亮，旧信号塔的风险被标记。"
    },
    {
      "event_id": "wick_store_pressure_battle_resolved",
      "turn": 5,
      "kind": "battle",
      "summary": "灯芯仓守住，补给线恢复，辉晶线索浮出灰烬。"
    }
  ],
  "research": {
    "active_jobs": [],
    "known_blueprints": [],
    "temporary_samples": [
      {
        "sample_id": "sample_trap_7f3a_repaired",
        "display_name": "折光绊索",
        "source_delta_id": "delta_run_demo_001_gray_lantern_station_2_battle_result_repaired",
        "summary": "从驿站战斗中回收的折光绊索样品，仍留有夜雾擦过的痕迹。"
      },
      {
        "sample_id": "intel_dark_echo_survey_001",
        "display_name": "东暗回声测记",
        "source_delta_id": "delta_stage_03_northern_road_scouting",
        "summary": "用灯灰和导线记录的短期侦测札记，可辅助下一场防守布置。"
      },
      {
        "sample_id": "asset_ash_burst_lantern_trial",
        "display_name": "灯灰爆鸣塔试作",
        "source_delta_id": "delta_stage_04_wick_store_pressure_battle",
        "summary": "灯芯仓防守中临时装配的爆鸣装置，适合继续整理成正式蓝图。"
      }
    ]
  },
  "flags": {
    "tutorial_first_battle_started": false,
    "tutorial_first_battle_completed": true,
    "stage_02_supply_line_review_completed": true,
    "stage_03_northern_scouting_completed": true,
    "stage_04_wick_store_defense_completed": true
  }
}
